,ABV,Beer Name,Beer Style,Brewery Name,name,creditCard,email,purchase,saleType,date
960,5.2,SMOKESTACKS,Rich porter brewed with malt smoked over apple & cherry woods,HAMELSWORDE,"Green, Maynard and Sparks",345082737881690,robertsstephanie@parker.com,28.97,bottles or cans,2019-01-12
961,4.0,BLONDE,A quaffing pale ale,HILLTOP,"Williams, Lowe and Wyatt",344815322643830,uboyd@gmail.com,85.22,draught,2019-01-07
962,4.2,GOLDEN ALE,A golden ale with a slight citrus note and earthy hop base,HILLTOP,Fischer-Patton,4481268285654417,wayneruiz@hotmail.com,55.6,bottles or cans,2019-02-15
963,3.9,BLACK COUNTRY BITTER,Golden straw fruity with a malty finish,HOLDEN'S ,Smith-Welch,4942074666150816,williamsdiana@reeves-cole.biz,24.02,draught,2019-03-04
964,4.4,GOLDEN GLOW,"Golden ale fragrant hop aromas,pleasant bitter finish",HOLDEN'S ,Tran-Smith,379580739246423,rcastillo@hotmail.com,90.0,bottles or cans,2019-02-10
965,6.0,DARK PEAK,Strong and dark with a hint of liquorice and a warming rum kick,HOWARD TOWN,"Cobb, Moss and Johnson",6011068159209122,christinawilliams@barnes.com,3.31,draught,2019-01-18
966,4.4,SUPERFORTRESS,Bittersweet ruby ale with malty caramel notes and fruity hops,HOWARD TOWN,Perez-Fitzgerald,630480355654,hwalker@anderson-fleming.biz,99.68,draught,2019-01-21
967,4.8,WEISSPEAK,"Bavarian style cloudy wheat beer bread, banana, cloves flavours",HOWARD TOWN,"Cardenas, Salinas and Nguyen",3088409521544462,gharris@myers.biz,29.85,bottles or cans,2019-03-19
968,5.0,HAVE YOU SEEN ME DOG ,A hoppy pale ale,IMPERIAL,Hernandez-Nguyen,180076867448849,warmstrong@henderson.net,37.54,draught,2019-01-18
969,4.5,NAH THEN ,Citra hopped pale ale,IMPERIAL,Marshall-Moss,5282263657189231,cory62@goodwin.com,56.61,bottles or cans,2019-03-18
970,6.0,STOUT WI NOWT TEKKEN OWT ,"Full bodied stout, 9 malts, slightly sweet, liquorice and spice",IMPERIAL,Martin-Robbins,4336507032518343,dakota49@bass-sullivan.info,61.9,bottles or cans,2019-04-24
971,5.0,BLACK TO THE FUTURE ,"Darkish pale in taste, caramel notes with a grapefruit hop burst",IMPERIAL/CHIN CHIN/TARN51/JAMES & KIRKMAN,"Gardner, Morris and Christian",6011456867930313,taylorchristopher@yahoo.com,46.39,bottles or cans,2019-03-05
972,5.3,MYRCE,"IPA hopped with cascade, centennial & citra ",INTREPID,Williams LLC,869907396878536,eroman@hotmail.com,50.5,bottles or cans,2019-03-27
973,4.2,NEW WORLD AMBER,Amber ale using NZ hops for a zingy more fruity flavour & aroma,INTREPID,Yoder-Dunn,346255045655738,gutierreztanya@whitney.org,33.03,bottles or cans,2019-04-21
974,5.1,PORTER,Full bodied porter using a blend of UK & US hops,INTREPID,Thomas-Harper,4133108634432,christopherfuller@hotmail.com,5.64,draught,2019-03-29
975,3.8,SESSION IPA,"Low ABV IPA using Eldorado, centennial & mosaic hops",INTREPID,Parker Inc,378678095203474,jonesbrent@aguilar.com,78.66,draught,2019-04-25
976,5.0,AMERICAN,"American Pale Ale with a peach, hoppy & subtle hay aroma",ISLE OF PURBECK,"Dixon, Rasmussen and Michael",675966366238,tjohnson@gmail.com,88.78,draught,2019-01-14
977,5.0,PLUM PORTER,Dark porter with added plums,JAMES & KIRKMAN,"Yoder, Booker and Murphy",4431000161409280,kathy18@gmail.com,79.56,draught,2019-04-07
978,4.0,SAAZ,"Blonde ale, refreshing, with  light biscuit finish & lemon notes ",JAMES & KIRKMAN,Lopez and Sons,4553849576693,joshua78@brooks.com,75.97,bottles or cans,2019-02-22
979,10.0,FULL CENTURION,"Full alcoholic kick, lovely hop character",KINVER,Blake-Patterson,3528032057535460,hopkinsstephen@hotmail.com,26.89,draught,2019-02-18
980,5.0,HALF CENTURION,Pale premium bitter with hop and citrus flavours,KINVER,Watkins Ltd,4036721858935548,wesley21@miller.info,85.72,draught,2019-02-17
981,4.0,QUARTER CENTURION,Light session ale brewed with English and American hops,KINVER,Hardy Inc,210091487666187,cbutler@stone.net,49.75,bottles or cans,2019-04-25
982,6.0,SEXY GENERIAN,Pale and strong bitter brewed with Nugget and Centennial hops ,KINVER,Ross Group,4334837197813714,diazdominique@hotmail.com,29.71,draught,2019-03-22
983,4.1,PENNINE AMBLER,Thirst quenching amber ale,KIRKBY LONSDALE,Nash-Hall,4066166873677787,donnaperkins@hotmail.com,19.55,bottles or cans,2019-03-17
984,4.2,RADICAL,Ruby red beer with a blend of English and European hops,KIRKBY LONSDALE,"Bennett, Boyd and Gillespie",30312691434677,brett27@hotmail.com,86.93,bottles or cans,2019-01-31
985,5.3,AMERICAN PALE ,Hazy and unfined pale ale with big US hop flavours,LENTON LANE,Beasley-Morse,503842217500,gmorales@silva-cox.com,24.61,bottles or cans,2019-04-28
986,4.2,ATLAS,"Rich, classic dry stout. Roasted & chocolate notes",LENTON LANE,"Ross, Watts and Baker",340893989038069,rhondawoods@hill.net,29.28,draught,2019-03-12
987,3.8,BLUEBIRD,"Light, dry hopped ale",LENTON LANE,"Ward, Lee and Robinson",3096304838993165,ryandavis@curtis.com,0.72,bottles or cans,2019-03-19
988,4.8,CENTENNIAL SMASH,Pale ale brewed with maris otter malt and centennial hops,LENTON LANE,Davis-Perez,180050979731707,maryfry@hotmail.com,4.14,draught,2019-01-28
989,4.2,CHERRY ATLAS,Cherry flavoured stout,LENTON LANE,"Walters, Collins and Bradley",676398357829,mary03@hotmail.com,6.28,bottles or cans,2019-02-02
990,5.0,CITRA SMASH,Pale ale brewed with maris otter malt and citra hops,LENTON LANE,"Santiago, Anderson and Landry",371175733086384,kellyscott@dorsey.org,7.25,bottles or cans,2019-03-19
991,5.5,EXPLORER,"Strong & hoppy IPA with citrus flavours & clean, bitter finish",LENTON LANE,"Holloway, Patterson and Elliott",4102150369742533,kathryn04@velazquez.com,55.2,draught,2019-02-21
992,4.2,GOLD RUSH,"Zesty, golden & crisp, easy drinking golden ale",LENTON LANE,"Dixon, Castaneda and Sanders",30293816219948,cookjoshua@yahoo.com,3.32,draught,2019-04-10
993,4.8,NELSON SMASH,Pale ale brewed with maris otter malt and nelson sauvin hops,LENTON LANE,Joseph Ltd,3088123436728967,danieladams@cox-cole.com,64.08,bottles or cans,2019-03-18
994,4.5,OUTPOST,Traditional best bitter with new world hops,LENTON LANE,Roberts and Sons,5595469503265875,zachary58@duarte.com,77.88,bottles or cans,2019-03-26
995,4.3,PIONEER,"Crisp, & golden, pale ale with a hoppy punch",LENTON LANE,Pace Inc,210054248560370,tpearson@gmail.com,84.67,bottles or cans,2019-04-14
996,4.2,VANILLA ATLAS,Stout with vanilla flavouring,LENTON LANE,"Carter, Thornton and Duarte",4169388541178,nicholas76@hotmail.com,94.07,bottles or cans,2019-01-25
997,4.4,CREST,"Malty, conker coloured best bitter ",LITTLEOVER,"Mccoy, Peck and Smith",5353975711416847,canderson@knight.com,81.01,bottles or cans,2019-04-05
998,4.0,DIABOLICAL LIBERTY,Traditional pale bitter dry hopped,LITTLEOVER,Robinson-Marsh,869945562019642,emily91@hotmail.com,3.2,draught,2019-02-16
999,4.1,EPIPHANY,"Pale ale rammed with Citra, Mosaic and Simcoe hops ",LITTLEOVER,Hernandez-Jackson,3528079651398373,evanslynn@king-blanchard.com,15.36,bottles or cans,2019-01-24
1000,5.2,HOLLOW LEGS,Full-bodied traditional Pale Ale with fruity malts,LITTLEOVER,"Rodriguez, Fox and Young",5351757411186835,williealexander@stewart-morrison.com,31.73,bottles or cans,2019-03-10
1001,4.2,THE PANTHER,"Rich warming stout, hints of coffee, chocolate & Irish whiskey",LITTLEOVER,Brown Inc,210087175247058,peterbailey@sanchez.com,58.23,draught,2019-01-21
1002,4.6,SHADE OF PALE,,LOST INDUSTRY,"Mckinney, Young and Rice",3528473904457773,kwalker@donaldson.org,14.81,bottles or cans,2019-01-01
1003,11.1,STREETS IN THE SKY,"Triple IPA hopped with Cascade, Falconer's Flight and Citra",LOST INDUSTRY,Cox-Schwartz,30147989655579,william47@whitehead-morales.com,49.23,draught,2019-01-28
1004,3.8,BLONDE,A Pale golden beer with a subtle hop aroma and smooth dry finnsih,LYTHAM,Dean LLC,561232475823,ematthews@gray.com,58.34,draught,2019-05-01
1005,4.2,GINGER NUT,Golden ale with subtle hints of ginger & hazelnut,LYTHAM,"Ellis, Baker and Martin",4002171348099,smithrobert@johnson-benitez.net,39.86,bottles or cans,2019-03-12
1006,4.3,GREEN HOP 2017,Extra pale brew with fresh hops from this year's harvest,MARKET HARBOROUGH,Walker-Brown,3088979541467704,wmendoza@curtis-holland.com,92.33,draught,2019-03-01
1007,5.1,TRES BIEN - PEACOCK,Pale amber brew with juicy hop flavours,MARKET HARBOROUGH,"Howe, Jones and Hughes",630477481505,sheryl55@gmail.com,95.1,draught,2019-02-18
1008,4.3,TRES BIEN - PORTER,"Traditional Porter. A little chocolatey, a little smokey",MARKET HARBOROUGH,"Lopez, Martinez and Ryan",5444377719730157,wjones@hotmail.com,91.64,draught,2019-02-28
1009,4.5,WHIRPOOL SERIES No6,Amber brew packed with flavour and featuring exotic US hops,MARKET HARBOROUGH,Navarro LLC,5426964246684890,deleondaniel@arnold.info,0.32,draught,2019-04-26
1010,4.5,FRANK,Irish style red ale,MARLPOOL,Burns-Wilkerson,869977146105647,thomas97@cortez.com,89.55,draught,2019-04-21
1011,4.2,STRAW'S GOLD,Pale bitter beer dry hopped with local wild hops,MARLPOOL,"Silva, Cobb and Heath",30350458905331,drewjones@johnson-maxwell.biz,33.92,draught,2019-03-24
1012,3.5,MERRI GOLD,"Golden Ale, light spiced hoppy ale with citrus aroma",MERRIMAN,Gonzalez-Williams,639069037732,martinjohn@hotmail.com,14.4,draught,2019-01-24
1013,4.0,MERRI L,Dark brown ale,MERRIMAN,Thompson Group,3112431089133462,jennifer22@castillo.biz,39.05,bottles or cans,2019-02-11
1014,4.2,AZACCA GOLD,"Pale golden, single hop brew, crisp & refreshing with citrus notes",MILESTONE ,Nguyen Inc,3096118093761392,tinabarber@hotmail.com,23.42,draught,2019-02-18
1015,5.6,HAMMER HEAD STOUT, Robust stout with a hint of liqourice and good bitter finish,MILESTONE ,Davis-Beard,6011823031255820,whitejulia@harris.com,28.01,draught,2019-02-04
1016,5.2,PLUM PORTER,"Smooth dark porter with plum essence,  with soft fruity flavour",MILESTONE ,Jones-Mullen,370765398322776,antonio80@gmail.com,6.29,draught,2019-01-04
1017,3.9,SUMMER LOVIN,Pale golden with refreshing tropical fruit flavours ,MILESTONE ,"Day, Watkins and Green",3528896811101300,lisa96@yahoo.com,52.71,bottles or cans,2019-01-11
1018,5.6,RASPBERRY WHEAT,Continental style fruit beer with a hint of raspberry,MILESTONE ,Hernandez and Sons,3158236867959102,dswanson@wood-le.org,22.14,bottles or cans,2019-03-07
1019,4.5,BLACK JACK PORTER,Full of robust flavours. Coffee is abundance. ,MILLTOWN,Hernandez Group,4086422795283428,vsanchez@hotmail.com,77.16,bottles or cans,2019-04-01
1020,4.1,TIGERS TAIL,Pale ale with slight citrus notes,MILLTOWN,King-Little,3112280904014971,megansandoval@campbell-chang.com,97.71,bottles or cans,2019-04-30
1021,4.2,APA,American pale ale  with lots of Simcoe and Chinook hops,MUIRHOUSE,"Wright, Collins and Frazier",3096373848442471,ochoatimothy@reid.net,0.24,draught,2019-01-24
1022,5.0,BACK IN THE BUILDING,Strong pale ale  with American hops (Citra and Simcoe),MUIRHOUSE,"Owens, Francis and Gonzalez",180048697950930,madisontodd@bridges-nguyen.com,11.68,draught,2019-01-21
1023,4.1,BLUEBERRY PORTER,Rich porter with a red tinge from the added blueberries,MUIRHOUSE,"Kim, Thompson and Kelly",6011431209668095,martinmark@chavez.biz,78.64,draught,2019-01-16
1024,4.5,PIRATES GOLD,Golden sweet beer with a bitter finish,MUIRHOUSE,"Baker, Wilson and Johnson",3096955571998065,wjones@johnston-garcia.com,76.93,bottles or cans,2019-04-23
1025,3.9,SHOPPING FOR HOPS,Pale session beer with a citrus bitterness,MUIRHOUSE,Kelley Group,3088274120487509,francodanielle@yahoo.com,41.01,bottles or cans,2019-03-25
1026,5.5,CITRA IPA,Single hopped IPA,NEEPSEND,Riley LLC,5559990166649158,yateslindsey@mckenzie-jones.com,72.5,bottles or cans,2019-04-19
1027,4.1,LOA,"Pale ale brewed with summit, azacca and chinook hops",NEEPSEND,Espinoza and Sons,6011933742271808,woodsalison@yahoo.com,99.26,bottles or cans,2019-01-03
1028,4.2,STOUR VALLEY GOLD,Floral aroma with a touch of spice & a mellow bitter finish,NETHERGATE,Hunter-Butler,60430098636,ygilbert@miller-bond.com,24.11,draught,2019-03-17
1029,5.0,UMBEL MAGNA,A 1750's porter with corriander,NETHERGATE,Weiss-Harper,30163626467559,danielperez@gmail.com,68.57,bottles or cans,2019-01-30
1030,3.6,CLARIDGE'S CRYSTAL,"Pale session ale, crisp and fresh with a slight citrus hop finish ",NOBBY'S,Dunn Group,180056298116330,moraleskyle@floyd.com,18.0,draught,2019-03-03
1031,4.0,DARK SPELL,Hearty red-amber ale with a slightly roasted dry finish ,NOBBY'S,"Wade, Torres and Hill",210081590994246,joshua07@hotmail.com,56.52,bottles or cans,2019-02-28
1032,4.0,GOLDINGS,Golden in colour with Golding hops,NOBBY'S,Perez PLC,345152061204544,snydermichael@yahoo.com,61.64,draught,2019-02-18
1033,4.4,PLUM PORTER,"Dark porter, with a subtle plummy bitterness. ",NOBBY'S,Smith PLC,5126580921315726,jamieali@gmail.com,14.37,bottles or cans,2019-04-24
1034,4.2,SWIFT NICK,"Golden ale, full mouth feel with an explosion of hops ",NOBBY'S,"Hamilton, Norton and Tran",5111110810836272,cartercorey@yahoo.com,18.99,draught,2019-04-18
1035,6.1,T'OWD NAVIGATION,"Strong dark ale, rich in malt and hop flavours",NOBBY'S,Gibson Group,4322486087997056,tammydaniels@hotmail.com,21.1,draught,2019-01-08
1036,5.2,HERETIC,"Chilli & lime stout, homegrown chillies, fruity flavours",NOMADIC,Harvey-Medina,4700028632439804,martinezchristina@hotmail.com,16.4,draught,2019-03-13
1037,5.8,NOMAD,"Flavour packed IPA, with simcoe, centennial & comet hops",NOMADIC,Moran-Russell,869921784866540,tylersanders@vargas.info,50.65,draught,2019-04-15
1038,3.8,PALE,Pale bitter with a hoppy kick,NOMADIC,"Taylor, Harvey and Thomas",3528008587150301,parkermelissa@hotmail.com,82.57,bottles or cans,2019-02-01
1039,4.0,AHTANUM,Pale hoppy ale with a floral citrus flavour. US ahtanum hops,NORTH RIDING,Cobb-Cox,4410625912488194,bryanricardo@white-beck.com,10.58,bottles or cans,2019-01-18
1040,4.3,MOSAIC,Pale ale full of blueberry and citrus flavours from mosaic hops,NORTH RIDING,Castillo-Chambers,4753722837309,perezjulie@davenport-harris.com,75.7,bottles or cans,2019-04-18
1041,4.0,PALE ALE V5,Trans pacific pale featuring US and Australian hops,NORTH RIDING,Hull and Sons,210042182159366,stephanie80@hotmail.com,68.34,bottles or cans,2019-01-22
1042,4.5,TIRAMISU PORTER,Porter  with coffee & chocolate added post fermentation,NORTH RIDING,Hernandez-Sanchez,3528057086897110,christopherfoster@yahoo.com,12.98,draught,2019-03-13
1043,4.4,NORTHALLERTON DARK,Dark ale brewed from chocolate malt & Admiral hops,NORTHALLERTON,"Potts, White and Wilson",344121503931866,andre22@hotmail.com,46.08,bottles or cans,2019-01-15
1044,4.2,YORKSHIRE GOLD,Bitter golden ale enhanced by Cascade and First Gold hops,NORTHALLERTON,Mendez Ltd,675911734092,qreynolds@gmail.com,26.19,bottles or cans,2019-01-12
1045,4.1,DETENTION,"A clean, straw coloured light drinking bitter. ",OLD SCHOOL,Carney LLC,4779739170883627,ozimmerman@yahoo.com,78.51,draught,2019-04-30
1046,3.8,SHOOT THE SERVANT,Dark Bitter with flavours of toasted caramel & subtle chocolate,PENTRICH,"Howard, Suarez and Cooper",3528196599226134,wwells@gmail.com,10.42,draught,2019-03-29
1047,4.7,SHADOW PLAY,Oatmeal stout.  Chocolate notes  with a subtle amount of roast,PENTRICH ,Potts-Turner,5195730335841884,biancaschroeder@hurley.biz,1.84,draught,2019-01-10
1048,4.5,EXCITRA,"Golden beer with grapefruit & floral aromas, crisp, hoppy finish",PHEASANTRY,"Martin, Lewis and Davis",210028621990404,michele79@gmail.com,16.48,bottles or cans,2019-04-02
1049,6.0,ORANGE PHEASANT,"Golden ale, with the zest of oranges & grapefruit in the aroma",PHEASANTRY,Dougherty Group,3112918331677239,christopher96@kennedy.com,82.3,draught,2019-02-02
1050,4.6,SMOKIN,Reddish amber. Starts sweet & followed by lingering smokiness,PHEASANTRY,"Martinez, Davis and Allen",30450207979940,hallalexander@gutierrez.biz,51.42,draught,2019-04-26
1051,4.5,BECKETTS ALE,Mahogany coloured with floral hoppiness,PHIPPS,Moore-Garcia,180065730566887,huntjoseph@andrade.com,98.99,draught,2019-02-19
1052,5.2,GOLD STAR,Strong golden export pale ale,PHIPPS,"Thomas, Smith and Clark",210099884612647,christopher88@gmail.com,53.98,bottles or cans,2019-04-26
1053,4.5,HEDDONISM,Golden bitter with a citrus hoppy flavour ,POTBELLY,Thomas Ltd,4106489813841,bfarmer@yahoo.com,63.94,draught,2019-02-27
1054,4.2,PIGGIN SAINT,Pale golden ale with New World hops,POTBELLY,"Jarvis, Cline and Robertson",869972356914366,cwright@hotmail.com,90.61,draught,2019-02-01
1055,3.8,BLONDE,"Crisp, refreshing, tropical, citrus aftertaste. Citra & Cascade hops",QUIRKY,Wise-Black,30027072685297,amber70@yahoo.com,36.17,draught,2019-01-14
1056,3.8,RUBY,English bitter with roasted carafa malt for a distinctive finish,QUIRKY,Kemp PLC,5432524948094459,thomasbradley@hotmail.com,51.2,bottles or cans,2019-03-27
1057,4.1,CF191, English pale with experimental CF191 hops ,RAW,Taylor-Pierce,375627621696548,luke75@yahoo.com,81.35,draught,2019-02-08
1058,5.9,CHOCOLATE GHOST,A chocolate IPA,RAW,Davis-Wu,180066583450658,brucelori@gmail.com,77.82,bottles or cans,2019-01-13
1059,6.2,FUNKY HOP DONKEY,"Collab with Pigeon Fisher - cloudy, hoppy New England IPA",RAW,"Bates, Wright and Howard",4822818118927170,ricethomas@michael.com,92.9,draught,2019-04-28
1060,3.6,KIWI PALE,NZ hopped Pale ,RAW,Johnson-Hernandez,30245707737388,cherylchapman@gmail.com,40.96,draught,2019-01-29
1061,4.9,NEW DAWN,An American amber,RAW,Stokes-Gibbs,6011936650499766,bhernandez@french.com,56.07,bottles or cans,2019-04-04
1062,4.6,XTREME OPPOSITE ATTRACTION,Collab with Pigeon Fisher - hybrid IPA ,RAW,Jones Group,5424980817393689,nancyfuller@hotmail.com,21.92,draught,2019-03-29
1063,4.5,BLACK BREAGHA,Full bodied stout with chocolate notes & roast coffee aftertaste,ROCK MILL,Williams-Turner,630496362314,jenniferjohnson@smith-ross.com,95.19,bottles or cans,2019-03-26
1064,4.3,RINGING ROGER,Traditional amber bitter with a fruity aftertaste,ROCK MILL,Green-Hayes,3337752197556701,jackie18@yahoo.com,21.35,bottles or cans,2019-03-25
1065,4.4,IGGY BEER,Pale ale brewed with German hops and lager malt,ROCK'N'ROLL,"Cole, Harris and Griffith",4378918940736431,cfuentes@gmail.com,98.13,bottles or cans,2019-02-27
1066,5.1,MASH CITY ROCKERS,Hoppy pale ale,ROCK'N'ROLL,"Clayton, Evans and Rodriguez",180074387313932,allencathy@hansen.info,0.9,draught,2019-01-21
1067,4.1,FALL ABOUT,Seasonal copper coloured bitter,ROWTON,"Scott, Johnson and Ray",3528311120482706,bassemily@yahoo.com,95.1,bottles or cans,2019-04-05
1068,3.8,PURE GOLD,"Golden, English hopped bitter",ROWTON,Fleming-Tate,3528930836014170,lynngalvan@hotmail.com,55.04,bottles or cans,2019-03-12
1069,4.1,HOPSCHISM,"Fruity, refreshing golden ale",SANDIWAY,"Benjamin, Hawkins and Rodriguez",675964464555,luceroashley@white.com,61.75,draught,2019-04-26
1070,6.0,DARK RUBY,Classic dark strong mild,SARAH HUGHES,"Roman, Strickland and Campbell",30435958549935,asanchez@hotmail.com,37.95,draught,2019-03-11
1071,4.9,OLD SAILOR,American style golden ale packed with hops. Tropical fruits ,SCARBOROUGH,Davis and Sons,5182719001374994,ronaldnorman@humphrey.com,96.82,draught,2019-01-22
1072,4.3,SEA LORD,American hopped ale. Subtle hints of lime and grapefruit ,SCARBOROUGH,Price-Jimenez,4095325370563,uwebb@hendrix-reed.com,16.82,bottles or cans,2019-03-26
1073,5.3,FIVE BELLS,"A dark rich ruby ale, with coffee notes",SHARDLOW,Morrison-Mcdaniel,3158991315674154,benjamin11@coleman.com,62.48,draught,2019-02-11
1074,4.8,MAYFLY,Chestnut coloured best bitter made with six different malts,SHARDLOW,White LLC,6011954848721033,joseph93@gmail.com,30.9,draught,2019-01-30
1075,5.3,TOMBSTONE,Dark amber brew dry hopped with goldings,SHARDLOW,Molina and Sons,4362295720130780,michellewolfe@hotmail.com,47.64,bottles or cans,2019-04-09
1076,5.0,WHILSTLESTOP,A strong pale golden ale,SHARDLOW,"Woods, Pacheco and Reed",180027111447681,anthony46@jones-james.info,82.3,bottles or cans,2019-02-03
1077,4.5,4 WOOD," Full-bodied, traditional Best Bitter",SHINY,Lewis Inc,6011398148356456,pcharles@wagner.com,68.33,bottles or cans,2019-04-23
1078,4.6,AFFINITY, Golden Bitter with lots and lots of fruity Citra hops,SHINY,"Garcia, Mays and Phillips",4519260681612459,tbarnes@nelson.com,15.62,draught,2019-03-08
1079,5.3,DISCO BALLS,A Big Hitting Hop Loaded IPA,SHINY,"Chandler, Spencer and Powers",30330922171132,parnold@munoz.org,22.49,draught,2019-02-03
1080,4.2,HAPPY PEOPLE, Sharp and citrusy golden ale,SHINY,Williams-Cook,210076985975321,cainlacey@gutierrez-casey.com,88.16,draught,2019-01-28
1081,3.7,NEW WORLD,Golden citrusy big hitter in terms of flavour,SHINY,Allen Inc,869966272633324,cruzrachel@gmail.com,82.93,bottles or cans,2019-02-04
1082,4.4,WRENCH,"Stout with 6 different malts, complex, rich flavour profile",SHINY,"Winters, Rosario and Gonzalez",4375372166266,powelllaura@gmail.com,70.02,bottles or cans,2019-04-07
1083,5.6,CLASSIC IPA,IPA with a touch of bitter honey and mild grapefruit finish,SILVERSTONE,Bryant-Gardner,4748809657166,lukehorton@gmail.com,40.09,draught,2019-01-21
1084,3.4,IGNITION,Clean and sharp blonde ale with American hops,SILVERSTONE,"Le, Stephens and Garcia",343026563125450,brianna05@mitchell.net,69.52,bottles or cans,2019-01-04
1085,4.8,OCTANE,"Golden ale, rich in malts with hints of honey and toffee",SILVERSTONE,Wood LLC,344084359700795,kleintroy@mejia.com,27.34,draught,2019-03-29
1086,4.5,MARAVILLA ,Brewed with Staffordshire Maravilla raspberries ,SLATERS,Vega and Sons,869997379758375,alyssa35@hotmail.com,10.04,bottles or cans,2019-03-23
1087,3.8,SADDLEBACK BITTER,Amber coloured conversational bitter ,SLAUGHTERHOUSE,Berg-Arnold,210088027664532,smithfernando@gmail.com,90.47,bottles or cans,2019-03-04
1088,3.9,AHTANUM,"Pale ale with ahtanum hops, dry hopped, strong hint of citrus",STAMPS,Burke-Gonzalez,869988578405975,alec71@castro.info,67.58,draught,2019-03-11
1089,3.7,BONDI BLONDE,"Simcoe & centennial hops,  citrus notes, a fresh, tasty, blonde ",STAMPS,Gallegos-Crane,379006025055724,qgreen@smith-harrell.com,31.28,draught,2019-01-14
1090,4.2,MAIL TRAIN,"Golden amber with distinct bitterness, pleasing malt character",STAMPS,Garcia-Harris,344791614087772,bgordon@gmail.com,94.76,draught,2019-04-13
1091,5.0,A STEAMING BUCKET OF CHILLI AND LIME,Added Chilli and Lemon. Andy Lee's 40 thousandth beer,STEEL CITY,"Baker, Lawrence and Sullivan",3088552940093825,alexandermyers@gmail.com,9.4,bottles or cans,2019-01-05
1092,5.0,DROP THE C BOMB V2,Pale and very bitter with fresh hop aroma and citrus notes,STEEL CITY,"Parker, Benton and Smith",4743386665838964,christopherweber@hotmail.com,94.54,draught,2019-01-16
1093,5.0,GET IN THE C,Pale and very bitter with citrus and tropical fruit flavours,STEEL CITY,"Levy, Edwards and Bolton",349745483690582,kcastro@yahoo.com,60.8,draught,2019-01-02
1094,5.2,INTERNATIONAL MAN OF MISERY,Combining trad dunkelweiss flavours with modern citrus hops ,STEEL CITY,Gonzales-Sandoval,869914340954645,lauraerickson@hotmail.com,53.56,bottles or cans,2019-04-01
1095,4.2,GINGER TINGE,Crisply hopped bitter with a ginger tinge,STOCKPORT,"Rodriguez, Cook and Johnson",869917309469224,carloswood@harper.com,7.69,draught,2019-01-25
1096,4.1,SOUTH ISLAND PALE,"Straw cpoloured, lycheearoma, citrus hoppy flavour",STOCKPORT,Becker-Nicholson,6011365535624689,miguelarmstrong@hotmail.com,15.5,bottles or cans,2019-01-24
1097,4.8,STOCK PORTER,Liquorice & malty nose with coffee & chocolate notes,STOCKPORT,"Walsh, Pham and Walker",3096858356627794,patricia07@love.com,92.55,draught,2019-04-26
1098,6.3,HOME GROWN,100% 'wet hopped' with Centennials from their own hop field ,TAPSTONE,"Mahoney, Clements and Moore",348864950067520,ohart@gmail.com,93.32,bottles or cans,2019-02-20
1099,4.2,SEA MONSTER,"Tropical flavours, citrus base, hints of blueberry, mango & lime.",TAPSTONE,"Taylor, Castro and Brady",3528619870620865,melissarich@hopkins.com,39.51,bottles or cans,2019-01-18
1100,4.0,ALTOFTS BLONDE,Session blonde ale,TARN 51,Johnston-Rivera,6011882978171978,zachary94@yahoo.com,63.08,draught,2019-01-01
1101,5.0,NEWLANDS STOUT,Creamy dark stout,TARN 51,Williams-Grant,869996314977918,jeffrey13@johnson-huang.com,61.03,draught,2019-02-25
1102,4.7,ARTS OF TELEFORCE,Oatmeal stout,THOUSAND TRADES,Austin Ltd,210085597256251,david32@santos.com,71.0,draught,2019-03-25
1103,5.2,COCONUT IPA,An IPA brewed with coconut and oats.,THOUSAND TRADES,"Hill, Bender and Nelson",869999116174080,rgutierrez@ruiz.com,66.64,draught,2019-01-09
1104,4.3,BAD UNCLE BARRY,West coast pale ale,THREE FIENDS,Barrera LLC,3158585533385716,johnstonmike@yahoo.com,33.25,bottles or cans,2019-03-08
1105,5.3,DARK SIDE ,"Cascadian Dark Ale, chocolate start with a bitter finish",THREE FIENDS,"Johnson, Davis and Allen",3337617143400090,johnsondavid@rodriguez.org,9.12,bottles or cans,2019-03-20
1106,4.7,CHERRY STOUT,New cherry stout,THREE HILLS,Hodges-Johnson,4305682467102215,ericwilliams@gmail.com,67.75,bottles or cans,2019-03-08
1107,5.5,HEIDRUN,"IPA hopped with Mosaic, Citra and Columbus ",THREE HILLS,James-Garcia,5414072951933942,stephanie11@gmail.com,20.74,draught,2019-02-10
1108,4.7,COFFEE ANISE PORTER,Porter brewed with lightly roasted coffee beans and star anise,TICKETYBREW,Davis Group,4696430349879,willie71@lane.net,62.18,bottles or cans,2019-01-20
1109,4.3,MUNCHNER,"Golden lager & Belgian ale combo. Biscuit taste, hop aroma",TICKETYBREW,Sanchez and Sons,675979855284,ywilcox@yahoo.com,45.89,draught,2019-01-23
1110,5.0,A NUGGET OF PUREST GREEN,Green hop beer (Collab with Beeston Hop),TORRSIDE,"Clark, Warren and Bowers",4818225443458176,stacyvillanueva@gmail.com,21.98,draught,2019-01-09
1111,4.5,BUGBEAR,"An American brown ale with roasty, chocolatey flavours",TORRSIDE,Hart-Mcdaniel,4164404802336147,ywatson@gmail.com,89.77,bottles or cans,2019-04-01
1112,4.5,EASTERN PALE INDIA ALE (EPIA),Indian tikka-spiced pale ale (Collab with Bexar County),TORRSIDE,Palmer Inc,180082437515042,rwilliamson@rodgers-colon.com,25.43,bottles or cans,2019-04-07
1113,6.2,HERR SIMCOE,Hop forward India porter,TORRSIDE,Contreras Ltd,869994356877526,ikelley@miller.com,54.95,bottles or cans,2019-03-29
1114,9.5,IMPERIAL PORTER,Imperial verson of an American porter,TORRSIDE,Martinez-Ellis,30537794652201,brandonboyer@gmail.com,75.99,bottles or cans,2019-02-03
