,ABV,Beer Name,Beer Style,Brewery Name,name,creditCard,email,purchase,saleType,date
649,6.6,WEST COAST IPA,"Citrus, pine, caramel, little bitterness - classic West Coast",RIVINGTON,"Meadows, Watson and Christensen",4411203263665,aprice@hotmail.com,48.81,draught,2019-03-24
650,5.8,ATLAS IPA,IPA made with 100% Maris Otter malt and UK Admiral hops,ROCKET ALES,"Benson, Peterson and Liu",5367378986436448,mosesshelly@gmail.com,38.14,bottles or cans,2019-02-10
651,4.2,BLOODHOUND,"Amber ale with fruity, sweet malt nose and hoppy edge",ROCKET ALES,Harrison-Brown,3158709029623733,drewandrews@gmail.com,33.88,bottles or cans,2019-02-05
652,3.8,KOMET BIER,German Kolsch style Session IPA ,ROCKET ALES,"Campbell, Sanders and Matthews",4749523858986200,laura15@davis.com,3.09,draught,2019-01-06
653,4.6,VOSTOCK STOUT,Russian stout brewed with 5 different malts,ROCKET ALES,Rojas PLC,3337201016630115,sarahbarron@steele.net,67.28,bottles or cans,2019-03-26
654,5.0,REALLY ROCKIN,"Quaffable strong pale ale, Chinook and Cascade hops drive it",ROCKIN ROBIN,Luna Group,30051640301088,nmorton@rose.info,68.32,bottles or cans,2019-04-07
655,3.7,RELIANT ROBIN,"Fresh hoppy session bitter, dry hopped to create floral notes",ROCKIN ROBIN,Duarte-Lawson,4757352203666,johnsonlisa@long.com,88.05,bottles or cans,2019-04-18
656,3.9,RPA,"American Pale Ale, Cascade hops dominate. Dry Hopped",ROCKIN ROBIN,Burton-Shah,675959379164,brian22@hotmail.com,15.54,bottles or cans,2019-03-08
657,5.5,PORTLY POLICEMAN,Porter with a sweet treacle taste and slight roast malt note,ROGUE ELEPHANT,Mills Inc,561263836117,martinezvincent@gmail.com,72.28,bottles or cans,2019-04-19
658,3.6,TOMMY GOODWIN MILD,Malty slightly sweet mild with a hint of roast chocolate malt ,ROGUE ELEPHANT,Mason Inc,4546162988529,obrienbonnie@yahoo.com,92.08,draught,2019-01-27
659,4.5,BEARDY BREW BLONDE,Sweet and juicy blonde ale with a natural haze,ROUNDHILL,"Kelley, Mcmillan and Lowe",3096092817307065,nelsonjonathan@yahoo.com,24.3,bottles or cans,2019-03-26
660,5.0,WELL SPRING APA,"English pale ale, citrus, tropical fruits and fresh hop",SAINTS ROW,Callahan-Tran,345244862722475,vdavis@gmail.com,93.16,bottles or cans,2019-01-01
661,4.4,ROMNEY AMBER ALE,Citrus and tropical fruit flavours with a hint of caramel,ROMNEY MARSH,"Stevenson, Cook and Soto",869929363338880,kmorris@yahoo.com,8.0,draught,2019-01-15
662,3.6,ROMNEY MARSH MELLOW,Pale ale blending five Kentish and American hops,ROMNEY MARSH,"Ware, Harding and Levy",376235738239233,umorales@russell.com,22.88,draught,2019-02-05
663,3.2,ROMNEY RYE,"Reddish brown, peppery dryness and gentle toffee notes",ROMNEY MARSH,Shelton-Roman,3088207142091776,antonio39@yahoo.com,81.81,draught,2019-01-22
664,4.1,BITTER,Traditional English bitter,ROUNDHILL,"Fitzpatrick, Lamb and Bell",501819164507,savannahboyd@short.biz,89.69,bottles or cans,2019-03-21
665,5.2,BPA,"Billingham Pale Ale, hoppy pale ale",ROUNDHILL,"Castro, Bailey and Smith",4311880887831130,kbennett@gmail.com,42.94,draught,2019-02-27
666,4.0,THE CATCHER PALE ALE,"Traditional EPA, citrusy and floral notes",SAINTS ROW,Glover Ltd,869937761638884,elizabethjohnson@yahoo.com,89.71,bottles or cans,2019-04-12
667,4.0,THE MOTH,"German style blonde ale, featuring German Tettnang hop",SAINTS ROW,Morales Inc,3528962991454388,tinabarry@roach.com,63.17,bottles or cans,2019-04-12
668,3.8,DEVON AMBER,"Amber ale, dry hoppy and fresh malty taste",SALCOMBE,"Soto, Acevedo and Davis",3528269629605484,pcaldwell@vaughn-sullivan.biz,11.36,bottles or cans,2019-02-03
669,4.2,GOLD,"Light refreshing straw coloured ale, brewed with USA hops",SALCOMBE,"Edwards, Austin and Paul",676250658579,caldwellbrooke@dean.com,75.65,bottles or cans,2019-01-24
670,4.8,LIFESAVER,Extra strong bitter,SALCOMBE,Bryant-Grimes,869971384196301,kerry87@mills.com,12.38,bottles or cans,2019-01-27
671,4.8,BLACKBERRY CASCADE,American style pale ale with a hint of blackberry,SALTAIRE,"Garza, Hatfield and Prince",869986242787802,allenrobin@yahoo.com,95.99,draught,2019-03-24
672,4.0,ELDERFLOWER BLONDE,Blonde ale infused with elderflower,SALTAIRE,Thompson PLC,6011858297437852,thomasxavier@hotmail.com,83.89,draught,2019-03-15
673,4.0,RASPBERRY BLONDE,Blonde ale  infused with raspberry flavours,SALTAIRE,"Hill, Gonzalez and Thompson",376179241014636,eric11@hotmail.com,17.72,draught,2019-01-28
674,6.0,DARK RUBY,The ultimate dark ruby ale,SARAH HUGHES,Shields LLC,869900998102660,sandersmelissa@gmail.com,7.38,draught,2019-04-19
675,3.8,BEERFEST AT TIFFANYS,"English session bitter, slightly spicy earthy aftertaste",SCRIBBLERS ,"Hunter, Blanchard and Lee",4488616695481172,natalie34@walker-morales.com,30.48,draught,2019-04-25
676,6.0,BEYOND REASONABLE STOUT,"Rich dark, well regarded stout",SCRIBBLERS ,Carr PLC,4125132497039043,cthomas@malone.com,46.15,bottles or cans,2019-02-23
677,4.2,HOPPY POTTER AND THE GOBLET OF ALE,A light coloured ale with citrus aromas,SCRIBBLERS ,Jones and Sons,4960556611626434,evanskayla@fernandez.com,98.97,bottles or cans,2019-04-08
678,4.8,MASHER IN THE RYE,Golden American style ale with a dash of rye malt,SCRIBBLERS ,Watts Group,3158861382595196,robert72@jackson-pitts.com,5.86,draught,2019-04-12
679,4.8,RUBECCA,Smooth ruby beer with hints of chocolate ,SCRIBBLERS ,Roman-Watts,5467723536414495,rachel04@yahoo.com,60.94,bottles or cans,2019-03-06
680,4.5,QUICK BROWN FOX,Tawny Brown Ale,SLIGHTLY FOXED,Matthews-Flores,869926942061611,gmcdonald@morris.biz,83.77,draught,2019-02-24
681,4.2,LIFE OF IPA,A great IPA,SCRIBBLERS ,Smith Inc,5562159187541761,michaelkelley@anderson-duke.com,37.12,bottles or cans,2019-03-27
682,5.2,ONE BREW OVER THE CUCKOO'S NEST,"A full strength, full hopped IPA",SCRIBBLERS ,"Martin, Baker and Davis",4661224558622,shawn99@yahoo.com,40.52,bottles or cans,2019-02-28
683,5.5,ONE SPECIAL BREW OVER THE CUCKOO'S NEST,An extra special dry hopped IPA,SCRIBBLERS ,Moore LLC,501805617799,pamelatrujillo@yahoo.com,2.0,draught,2019-03-23
684,4.9,BLACK OAR STOUT,"Stout with aroma of coffee, chocolate, liquorice, and molasses ",SKIPPOOL CREEK,"Woods, Adams and Miller",340022510438842,harrisamanda@hernandez.biz,6.24,bottles or cans,2019-02-23
685,3.8,CROW'S NEST BITTER,British bitter with Admiral hops for bittering and Boadicea hops,SKIPPOOL CREEK,"Wang, Fry and Martinez",6011120120489919,joneslarry@harris.com,10.56,bottles or cans,2019-03-29
686,4.2,TOP SAIL PALE,Very light coloured traditional British pale ale,SKIPPOOL CREEK,"Lester, Cox and King",3088974516327991,jameskelley@gmail.com,23.81,bottles or cans,2019-01-22
687,4.5,FLYING FOX,Golden with apricots,SLIGHTLY FOXED,Johnson-Taylor,5140783995526358,rochakenneth@murphy.org,39.73,draught,2019-02-05
688,5.4,CASEMATE IPA,"Hoppy IPA, hazy, dry and loads of flavour",SOUTHSEA BREWING,Rowland PLC,30025609167961,isweeney@richards.org,95.29,bottles or cans,2019-03-08
689,5.3,WEISSCAPS,"German style wheat beer, fruity banana sweetness",SOUTHSEA BREWING,Pierce-Hill,30525754340735,cphillips@gmail.com,1.52,bottles or cans,2019-05-02
690,4.4,BERMONDSEY BEST BITTER,Traditional English best bitter,SOUTHWARK,Miller-Rocha,5453696679114195,samuelnewman@gonzales-anderson.com,9.7,draught,2019-02-18
691,5.5,HARVARD APA ,A highly-hopped American Pale Ale,SOUTHWARK,Woodward-Smith,5589589054777172,ohill@davenport-garcia.com,45.88,draught,2019-04-14
692,4.8,HEFEWEIZEN,Wheat beer with notes of banana & cloves,SOUTHWARK,Davidson Ltd,4471755060869816,davidrios@hull.info,29.99,draught,2019-03-07
693,4.0,LPA (London Pale Ale),"Session Pale Ale, light, hoppy with citrus tones",SOUTHWARK,Rich LLC,341458458746227,onelson@gmail.com,27.93,bottles or cans,2019-03-21
694,8.9,PETER'S RUSSIAN IMPERIAL STOUT,"Russian Imperial Stout, strong chocolate & burnt malt flavours",SOUTHWARK,"Mason, Thompson and Cortez",4578160315872438,riverasandra@atkins.biz,22.78,draught,2019-01-23
695,4.0,MAGIC MUNTJAC,Tropical zesty light pale ale,STAG (Kent),Edwards-Woodard,676197234278,kennedymark@martin.com,4.48,draught,2019-03-20
696,4.8,RED IMPERIAL,Dark English bitter with spicy toffee flavours,STAG (Kent),Mcdaniel-Thompson,4883835455887,dshepard@nguyen-smith.net,37.95,draught,2019-03-20
697,5.0,FIVE VALLEYS,"Traditional chestnut coloured, rich and fruity strong ale",STROUD,Sanders-Ward,5502256353074099,adamjackson@bailey.net,62.56,draught,2019-03-27
698,4.7,BAREFOOT BLONDE,Super refreshing Cascade hopped pale/pilsner hybrid,TENBY BREWING CO,Watkins-Barker,503844772395,jennifer72@black.org,42.85,bottles or cans,2019-01-08
699,5.2,MEADOWS MOONDANCE,Robust IPA in the English style with strong bitter backbone,STONEY FORD,"Vasquez, Villegas and Williams",3158245166088075,matthewcarter@hotmail.com,25.2,draught,2019-04-08
700,3.8,SHEEPMARKET SUPERNOVA,"Pale summer ale, floral, cedar, grapefruit and peach",STONEY FORD,"Neal, Graves and Vance",30183384686612,steven68@sanford-lopez.com,57.28,bottles or cans,2019-04-14
701,4.4,STAMFORD 50,"Brown Porter,  combination of malts and UK hops",STONEY FORD,Reed LLC,6011999761615928,lwilliamson@kelly.biz,62.47,draught,2019-01-16
702,4.5,RAMBLERS REWARD,NEW BEER,STROUD,Sanders Inc,30316313166906,zpierce@hotmail.com,89.02,draught,2019-01-20
703,5.5,EXTENDED OVERDRAUGHT IPA,Hoppy IPA  ,STU BREW,Rodgers LLC,5586286019039490,ramirezdonna@garcia-pugh.biz,16.84,draught,2019-03-23
704,4.1,29 IN A MILLION,English hopped ale,TAP SOCIAL MOVEMENT,Hernandez-Zavala,3337883994296686,whiteelizabeth@cox.com,80.41,bottles or cans,2019-04-05
705,5.5,GREBES PROCESSION,Rich and roasty oatmeal stout,TAP SOCIAL MOVEMENT,"Edwards, Olson and Duran",3158052685070786,wilcoxbrittany@yahoo.com,39.26,bottles or cans,2019-01-16
706,6.0,HAMMERHEAD 7 SEAS,"Sweet, fruity juice bomb, casked especially for the festival",TENBY BREWING CO,"Crosby, Salazar and Bradford",3112568474032591,robertssteve@yahoo.com,35.54,bottles or cans,2019-02-06
707,5.6,INTERGALACTIC,"Juicy, hoppy, pale wheat beer,  casked especially for the festival",TENBY BREWING CO,"Nguyen, Maxwell and Harris",376402097843225,michellesanchez@anderson-werner.biz,77.34,draught,2019-03-25
708,4.6,SIR GALAHAD,"Red ale, complex malt character, a rich ruby red colour",TENBY HARBWR,Mills PLC,180055470857919,gibsonkimberly@hotmail.com,15.6,bottles or cans,2019-02-20
709,4.2,NORTH STAR,"Malty amber ale, spicy blackcurrant and lemon aroma",TENBY HARBWR,Cruz-Perkins,4894730008265939,davidshannon@browning-yu.com,62.84,draught,2019-01-02
710,4.8,ANY PORTER IN A STORM,"Traditional English porter, with intense malty & treacle aroma",THIRST CLASS,Brown Ltd,3112802225141991,asmith@yahoo.com,98.25,bottles or cans,2019-04-13
711,6.0,HOPFORDIAN,"Fruity IPA full of American hops Cascade, Willamette and Simcoe",THIRST CLASS,"Perez, Graham and Baker",869960223881736,cody97@lopez-kelly.com,25.91,bottles or cans,2019-03-22
712,4.4,NEW ZEALAND PALE ALE,Session pale brewed with healthy dose of Rakau& Wai-iti hops,THIRST CLASS,Lowe PLC,3158927526030554,stephen72@fernandez-bell.com,96.99,draught,2019-02-27
713,5.0,FLIGHT OF THE UNICORN v2,"Nelson Sauvin, Citra & Simcoe IPA",THREE BLIND MICE,Evans-Miranda,347090695022296,kevin42@campbell.info,44.5,draught,2019-04-22
714,5.3,MILK WORM,Chocolate and Vanilla milk porter,THREE BLIND MICE,Myers-Vance,345837371284588,michaelwilson@gmail.com,25.81,bottles or cans,2019-04-17
715,7.4,UPSIDE DOWN IPA,"Black IPA hopped with Citra, Mosaic, Summit & Nelson Sauvin ",THREE BLIND MICE / BAKERS DOZEN,Williams-Hampton,4230712247919503,vchambers@manning.org,92.19,draught,2019-04-28
716,4.1,THAIPA,"Crisp hoppy ale with spicy, citrus flavours",THREE BROTHERS,"Anderson, Sutton and Dixon",30520388490428,reyesthomas@rollins.com,53.77,bottles or cans,2019-03-02
717,5.6,HEART 'N' SOUL MOSAIC PALE,Mosiac hopped IPA,THREE KINGS,Gonzalez-Hurley,4042599693789532,jennifer92@johnson-long.biz,83.31,bottles or cans,2019-02-09
718,4.6,T.A.PALE,Copper coloured best bitter,TIPSY ANGEL,"Graham, Chapman and Nelson",869978259662846,brownchristopher@flynn-williams.com,14.05,draught,2019-03-13
719,5.0,SHORT & STOUT,"Stout, with a chocolate body and hoppy punch",THREE BROTHERS,Tran PLC,210094840341787,stephanie09@hotmail.com,48.19,draught,2019-04-29
720,3.7,THE EX WIFE BITTER,Session bitter with subtle notes of toffee,THREE BROTHERS,Jones Group,6011066704545438,frederickrodriguez@winters.info,59.94,bottles or cans,2019-02-12
721,4.1,DARK SIDE OF THE TOON ,Dry stout with dark chocolate and roast coffee notes,THREE KINGS,Torres-Reynolds,502042639760,donald69@gmail.com,74.89,bottles or cans,2019-04-23
722,3.9,RIDE THE PINE,Citrus pale ale,THREE KINGS,Jones Ltd,30335360773174,danielletaylor@gmail.com,22.68,bottles or cans,2019-01-26
723,3.8,SUPER MAC,Hoppy golden ale,THREE KINGS,Clayton Inc,4714256970520521,audreymorris@graham-green.net,84.74,bottles or cans,2019-02-07
724,4.2,JADE HOP,A pale ale brewed with NZ hops,TIGERTOPS,Moreno Group,3337430255968957,tjoyce@hotmail.com,6.99,bottles or cans,2019-03-26
725,4.9,TASMAN BAY,A pale ale with Australian hops,TIGERTOPS,Wolf Group,6011084048268229,brownelizabeth@ballard.net,48.77,bottles or cans,2019-02-13
726,5.0,OATMEAL STOUT,Traditional oatmeal stout,TIPSY ANGEL,Fischer and Sons,210028793262178,joshuabanks@long.com,70.67,draught,2019-03-14
727,4.2,BLACK LACE,Chocolate milk stout with roasted coffee & dark chocolate notes ,TOM HERRICK'S,Mahoney-Hickman,4011076841284432,danielteresa@meyer.com,68.14,bottles or cans,2019-01-11
728,5.0,GAUCHO,"South American IPA, brewed with a hint of green tea and apricot",TOMOS A LILFORD,Sanchez Group,4766705569376,nicolasbranch@gmail.com,0.79,bottles or cans,2019-02-08
729,3.8,HOP CLUB,Fresh green hopped pale ale,TOMOS A LILFORD,"Harrison, Lutz and Lee",4948953005603292,rgould@gmail.com,24.01,draught,2019-04-29
730,4.2,BICYCLE BLONDE,Blonde ale,TOMOS WATKIN,Stafford-Williams,3096256777207256,harrisonbenjamin@gmail.com,13.1,bottles or cans,2019-01-06
731,5.7,EL CAPITAN,"New England IPA, packed full of citrus & tropical hops",TRACK,Reynolds Inc,60471687115,carpenterkari@gmail.com,83.15,bottles or cans,2019-01-18
732,3.8,SONOMA,Pale with smooth citrus aroma,TRACK,Martin PLC,4246004557869,rosariobilly@hotmail.com,63.93,draught,2019-03-18
733,5.6,TOBA,"Oatmeal Stout, coffee and chocolate come through really nicely",TRACK,Weaver-Jordan,30262856321500,james56@roberts.com,4.99,bottles or cans,2019-04-21
734,4.3,CLASSIC,"Best Bitter, deep amber, malty beer",TREEN'S,Savage-Hayes,348434720877564,nmurphy@hotmail.com,51.78,draught,2019-04-23
735,4.4,DARK ARTS,"Rich & dark traditional porter, coffee, chocolate and caramel",TROUBLE BREWING,Savage-Dennis,3337606641959590,robin81@hart-reynolds.com,59.26,draught,2019-03-07
736,4.5,PILSNER,Classic cask pilsner with German hops,TRYST,Martin-Andrade,343076140197639,brownelijah@yahoo.com,43.66,draught,2019-05-02
737,5.9,CLOUD CUCKOO,"Deep ruby, full-bodied, plum and soft fruits notes",TREEN'S,"Cunningham, Howard and House",6011043501481125,tbaker@jimenez.biz,10.37,draught,2019-01-28
738,5.3,RUBY IPA,Full bodied ruby ale with a powerful hop bite and nose,TREEN'S,Robbins PLC,6011360564096396,xcunningham@turner-hall.net,49.92,draught,2019-02-16
739,4.6,BLOOD BROTHER,Blood orange black IPA,TROUBLE BREWING,"Cook, Rubio and Gibson",503804638412,christina87@yahoo.com,80.47,bottles or cans,2019-02-20
740,3.7,WALK ON THE MILD SIDE ,Mild with chocolate & roast notes. Aroma of toasty chocolate,TROUBLE BREWING,Jones LLC,4947381350303,mlloyd@gmail.com,88.72,draught,2019-02-12
741,4.4,GRAFITTI,"Session pale ale, flavourful punch beyond it’s modest ABV",TROUBLE BREWING,Davis-Durham,4441886183220061,tjones@haynes-pollard.info,48.01,bottles or cans,2019-02-18
742,5.5,SABOTAGE,Amber English hopped IPA,TROUBLE BREWING,"Chen, Hayes and Rodgers",376230011699518,glen31@hotmail.com,91.55,draught,2019-01-05
743,4.4,COCONUT & CHOCOLATE PORTER,Rich chocolate porter with toasted coconut,TRYST,Finley PLC,372719059432265,janetsmith@yahoo.com,34.79,draught,2019-01-20
744,5.5,RAJ IPA,Traditional IPA recipe loaded with hops,TRYST,"Wright, Matthews and Murphy",180003116806346,palmererica@clay.net,49.29,bottles or cans,2019-03-27
745,5.0,CHAOS THEORY,Honey & Marigold Oatmeal Pale,TURNING POINT,"Johnson, Arnold and Hinton",374643256942009,stephanieballard@yahoo.com,60.12,draught,2019-04-06
746,5.0,LUCID DREAM,Cookie & Cream Stout with Cacao nibs and chocolate malt,TURNING POINT,Hernandez PLC,30347037160602,cherylabbott@gmail.com,37.44,bottles or cans,2019-04-21
747,6.0,SUMMER GROVE,"Tangy, zesty, white IPA  with rose petals, oranges & gooseberries",TURNING POINT,Mason-Morris,6011450577837603,tiffany85@yahoo.com,85.93,bottles or cans,2019-03-08
748,5.8,DAYWALKER,"Oatmeal stout, floral hop aroma, roasted barley, hint of coffee",TWISTED ANGEL,"Walker, Foster and Hardin",3096699623015466,brenda94@hotmail.com,65.95,draught,2019-02-16
749,4.0,SHAPESHIFTER,American pale ale,TWISTED ANGEL,"Walker, Martin and Pruitt",503828836331,tiffany06@foster-travis.biz,8.87,bottles or cans,2019-04-02
750,5.0,AMARILLO SINGLE HOPPED ALE,Single hopped IPA with Amarillo hop,TWO BY TWO,"Ho, Alexander and Simmons",30370142549105,carmenwilliams@gmail.com,40.13,draught,2019-03-09
751,5.5,BIRTHDAY BEER MOSAIC AND CITRA JUICE BOMB,"Brewery 3rd birthday beer, tropical juice bomb",TWO BY TWO,Powell Inc,5390918972078646,lpatel@hotmail.com,5.21,bottles or cans,2019-03-29
752,5.0,OUSEBURN FARM CHARITY BEER,"Charity beer packed with Chinook, Equinox and Citra",TWO BY TWO,Atkinson-Liu,4076950445326,curtislisa@price.org,32.82,draught,2019-04-26
753,6.2,SOUTHPAW IPA,"Fruity, hoppy, English IPA",TWO BY TWO,"Harrell, Higgins and Bailey",869957786863606,patricktodd@hughes.com,21.34,bottles or cans,2019-03-22
754,3.4,BUCKEYE SESSION BITTER,"Easy drinking, copper-coloured beer",UNITY (Worcs),Brown Ltd,3337684600062409,georgemacias@chen-cantu.net,23.28,bottles or cans,2019-04-06
755,3.8,SEBRIGHT,Straw-coloured ale with fruity hop aromas,UNITY (Worcs),Bartlett-Peters,5528949456383850,jsanchez@santana.com,46.55,bottles or cans,2019-01-10
756,4.9,MALT FEAKES,Best bitter with complex malt flavours,URBAN CHICKEN,"Garner, Dean and Snyder",30546548731070,youngcindy@long.org,73.36,bottles or cans,2019-04-04
757,4.4,GREEN HOP IPA,Fresh green hopped IPA,TYNEBANK,Hernandez Inc,210014973850537,stevencastro@hotmail.com,8.61,bottles or cans,2019-03-14
758,5.0,FRIZZLE BRITSH IPA,"Rich golden in colour with a fruity, floral hop aroma ",UNITY (Worcs),Kennedy-Callahan,3088672606615735,reynoldslisa@hotmail.com,57.92,draught,2019-01-22
759,4.0,PEKIN PALE,"Golden ale, fruity and hoppy",UNITY (Worcs),"Hansen, James and Franklin",379836984024802,pcollins@smith.net,70.86,bottles or cans,2019-03-28
760,4.2,MONNOW,Chestnut coloured English bitter,UNTAPPED,Palmer-Rodriguez,4945889597037,marymurphy@beard-franco.com,58.88,bottles or cans,2019-01-17
761,4.0,SUNDOWN,"Golden colour, distinct flavour, Goldings & Challenger hops",UNTAPPED,"Jones, Herrera and Butler",6011795074686303,usantos@marshall-johnson.net,15.65,draught,2019-04-23
762,4.9,"TRIPLE ""S""","Intense black stout, rich upfront flavours",UNTAPPED,"Weaver, Davis and Shannon",6011921160158235,njenkins@sherman.com,28.89,draught,2019-02-21
763,4.5,UPA,"IPA, distinctly hoppy, with  aromas from Styrian Goldings hops",UNTAPPED,"Walton, Olson and Wise",4566300378638656,chanson@hotmail.com,33.23,draught,2019-03-27
764,6.5,BIRD FLUID,American IPA with refreshing citrus finish,URBAN CHICKEN,Martinez Ltd,4761963656261765,thomaselizabeth@gmail.com,89.23,bottles or cans,2019-04-26
765,4.5,BODY POP,Session IPA with tropical fruit flavours from Australian hops,URBAN CHICKEN,Adams-Ellison,3337500814900020,cohensharon@hotmail.com,30.12,draught,2019-02-27
766,4.9,PIT PONY STOUT,Oatmeal Stout with coffee and chocolate notes,URBAN CHICKEN,Proctor PLC,30325623350308,robertsonjulia@gmail.com,96.66,draught,2019-04-04
767,4.6,DSB (Dolly's Special beer),Light refreshing Summer ale,URBAN ISLAND,Gray-Jones,30076285146423,phillip54@boone-barton.com,5.14,draught,2019-01-11
768,4.5,ADMIRAL GARDNER,"Pale ale,  tropical fruits and mango, a fruity balanced bitter",UTTOXETER,"Vega, Bailey and Black",6011568964394712,ycarter@velez.com,72.4,draught,2019-02-09
769,5.2,AMERICAN IPA,"American IPA, powerful in strength, bitterness and fruitiness",UTTOXETER,Coffey Group,5155618499748862,englishherbert@gmail.com,89.96,bottles or cans,2019-03-15
770,3.7,BUNTINGS BLONDE ,"Blonde low alcohol ale, lemon-grapefruit, citrusy flavour",UTTOXETER,"Rios, Williams and Martinez",343911458349978,ryan41@johnson-grant.net,73.92,draught,2019-02-09
771,4.7,FULL GALLOP,"English brown ale, malty beer with sweetness & toffee notes",UTTOXETER,Miller PLC,869997050525986,lbrewer@hotmail.com,81.36,bottles or cans,2019-03-29
772,4.8,PADDOCK PORTER,"Chocolaty, dominated by a distinctive dark grain flavour",UTTOXETER,Scott-Hernandez,347157277732186,sancheztiffany@gomez.info,35.71,bottles or cans,2019-03-05
773,4.2,PARADYM SHIFT,American amber / red ale,VALE OF GLAMORGAN,Wilson LLC,4267649362227948,melissapaul@hopkins.biz,35.9,draught,2019-02-10
774,3.8,SESSION,"Classic session bitter, tangy and moreish",VOLDEN,Lopez Ltd,5211854711913784,fhunter@silva.com,89.64,draught,2019-02-06
775,3.8,PALE,"Pale session ale, Target and Fuggles with crushed Elderflower",WELL DRAWN,Werner-Tucker,869905309679496,jessica17@gmail.com,3.75,draught,2019-04-18
776,4.7,CHAOS,Monstrously hopped pale ale,VALE OF GLAMORGAN / CASK BEER CO,"Kelly, Becker and Nunez",30378442961011,krystal20@thomas.org,77.21,bottles or cans,2019-01-16
777,4.8,JUNIPER,Red rye autumnal beer with Juniper berries,VOLDEN,Ryan PLC,6011492521629306,davisdustin@armstrong-adkins.biz,9.34,draught,2019-03-22
778,4.6,PALE ALE,Straw coloured with a long hop finish,VOLDEN,"Johnson, Johnson and Brown",869927910732647,strongjennifer@hotmail.com,38.55,draught,2019-01-31
779,5.5,GINGER WEAL,Strong golden ale. The addition of ginger gives a spiciness kick,WEAL ALES,"Cardenas, Acevedo and Bolton",3112379803409744,christopherwalter@ritter.com,10.22,draught,2019-02-09
780,4.1,WEALD WOOD,Multi hopped session beer made with extra pale malt,WEAL ALES,Johnson Ltd,3088006262390640,dbrown@holmes-jones.com,58.98,bottles or cans,2019-03-21
781,4.6,WELLER WEAL,"Pale ale made with extra pale malt, lots of Mosaic & Citra hops",WEAL ALES,Richards-Herring,3112423945357716,teresathomas@walter.com,30.36,draught,2019-03-25
782,4.4,GOLD,"Golden, refreshing, bold in flavour using Celeia hops",WELL DRAWN,Lopez and Sons,60447494638,dlewis@gmail.com,83.92,draught,2019-02-23
783,4.1,GRISETTE,"Grisette - similar to a saison, but with a cheeky dry hop!",WEST BY THREE,Bishop-Bond,503821288480,marypham@hotmail.com,59.11,bottles or cans,2019-01-11
784,4.5,CHOCOLATE MILK STOUT,Choco milk Stout,WEST BY THREE,Mills Group,5319635681582159,fwalker@hotmail.com,25.41,bottles or cans,2019-02-09
785,4.2,EARL GREY BITTER,"Golden brown English bitter with a hoppy, fruity aroma",WHIM,Gutierrez-Lynch,4905962203243091,josephmiles@hotmail.com,62.86,bottles or cans,2019-01-08
786,4.9,SNOW WHITE,Bavarian style coriander wheat beer (Cloudy),WHIM,"Anderson, Summers and Webb",869967497096800,daniellehoover@rodriguez.biz,4.6,draught,2019-02-11
787,3.9,BLACK BEAUTY,"Rich Ruby in colour, using chocolate malt and English fuggle hops",WHITE HORSE,"Jennings, Hughes and Mueller",589327669315,utaylor@gmail.com,29.06,draught,2019-04-07
788,4.3,OXFORD DARK BLUE,A dark chestnut coloured beer with a smooth rich flavour,WHITE HORSE,Young-Thomas,30186637748329,qwhite@yahoo.com,48.97,bottles or cans,2019-04-14
789,4.5,BELFAST ALE,"Russet ale, rich fruitiness is followed by a gentle hop flavour ",WHITEWATER,"Burns, Bennett and Reese",348307194300232,salasjames@hotmail.com,29.83,bottles or cans,2019-01-07
790,5.0,CLOTWORTHY DOBBIN,A dark Irish porter,WHITEWATER,"Howard, Harper and Adams",376123198876829,parkercatherine@yahoo.com,28.61,bottles or cans,2019-03-29
791,3.7,COPPERHEAD,Copper coloured with very intense flavour of hops and spice,WHITEWATER,Wiggins-Jones,30188846127774,courtneywalker@hotmail.com,34.82,draught,2019-03-19
792,6.0,HOPPELHAMMER,Muddy orangy beer beer with tastes of hops and exotic fruits,WHITEWATER,Rodriguez-Hamilton,4604824302792929,woodhaley@sellers-perez.net,83.21,bottles or cans,2019-04-28
793,4.5,KING OF HEARTS,Blonde ale,WILD CARD,Mullins-Moore,210087490511865,bgardner@reese-mcintosh.com,54.9,draught,2019-03-02
794,3.8,NEW ZEALAND PALE ALE,New Zealand Pale ale,WILD CARD,"Walker, Freeman and Alexander",4543565477952,corywalker@jackson.org,27.92,draught,2019-03-10
795,4.0,QUEEN OF DIAMONDS,Session IPA,WILD CARD,Trevino LLC,6011868648140535,brandidaniel@medina-reyes.net,72.26,bottles or cans,2019-01-06
796,4.5,AMERICAN SESSION IPA,Golden American session IPA with Cascade hops,WINDMILL HILL,"Robertson, Atkinson and Love",4460616612812055,parkerricky@yahoo.com,40.23,bottles or cans,2019-01-01
797,4.2,CHESTERTON IPA,"Golden amber in colour, hints of roast malts and light fruits",WINDMILL HILL,Humphrey Inc,6011639278066112,danielleward@hotmail.com,77.09,bottles or cans,2019-03-10
798,3.8,MALTHOUSE DORMOUSE,Golden charity beer for Warwickshire Wildlife Trust,WINDMILL HILL,Byrd LLC,210021652841133,ryanregina@gmail.com,1.12,draught,2019-03-29
799,4.0,THE AMBER POST,Classic amber ale with a hoppy twist,WINDMILL HILL,Boyd PLC,4430094253619774,npope@hotmail.com,85.7,bottles or cans,2019-01-20
800,4.0,CANBERRA,Chestnut brown autumn ale with full tropical fruit hop,WINDSOR & ETON,Hughes Group,4223076890767,morgandavis@duncan-garcia.com,85.06,bottles or cans,2019-02-26
801,5.0,CONQUEROR BLACK IPA,"Dark, complex, intense. Roast and smokey with Cascadian hop",WINDSOR & ETON,"Coleman, Santiago and Ramirez",60487008488,schmidtbonnie@hotmail.com,5.4,draught,2019-01-20
802,3.8,KNIGHT OF THE GARTER,Sunshine in a glass - grapefruit zestiness,WINDSOR & ETON,Conner Ltd,210004794049468,pcarter@webster.com,49.79,draught,2019-01-24
803,4.0,BLONDE SUMMIT,Blonde ale brewed with Summit hops,WITHNELL'S,Pace LLC,4581899740216,dustin82@myers.com,75.74,bottles or cans,2019-03-13
